cik,registrant_name
1265708,NUVEEN TAX ADVANTAGED TOTAL RETURN STRATEGY FUND
1267994,ARDEN SAGE TRITON FUND LLC
1267902,WESTERN ASSET/CLAYMORE INFLATION-LINKED OPPORTUNITIES & INCOME FUND
1273906,MADISON HARBOR BALANCED STRATEGIES INC
1275214,CALAMOS STRATEGIC TOTAL RETURN FUND
1275617,COHEN & STEERS INFRASTRUCTURE FUND INC
1275902,"HELIOS STRATEGIC INCOME FUND, INC"
1276533,NUVEEN FLOATING RATE INCOME FUND
1276469,MACQUARIE/FIRST TRUST GLOBAL INFRASTR/UTIL DIV & INC FUND
1278460,ADVENT/CLAYMORE ENHANCED GROWTH & INCOME FUND
1278895,"BLACKROCK ENHANCED CAPITAL & INCOME FUND, INC."
1279014,WELLS FARGO ADVANTAGE UTILITIES & HIGH INCOME FUND
1278211,LAZARD GLOBAL TOTAL RETURN & INCOME FUND INC
1279038,O'Connor Fund of Funds: Aggregated Alpha Strategies LLC
1281926,Eaton Vance Tax-Advantaged Global Dividend Opportunities Fund
1280936,BLACKROCK S&P QUALITY RANKINGS GLOBAL EQUITY MANAGED TRUST
1279392,ENDOWMENT MASTER FUND L P
1279394,ENDOWMENT REGISTERED FUND L P
1282957,GABELLI GLOBAL UTILITY & INCOME TRUST
1283721,WESTERN ASSET INFLATION MANAGEMENT FUND INC.
1282850,FIRST TRUST SENIOR FLOATING RATE INCOME FUND II
1285650,CALAMOS GLOBAL TOTAL RETURN FUND
1285155,GENERATION HEDGE STRATEGIES FUND LLC
1284940,FIRST TRUST ENERGY INCOME & GROWTH FUND
1286410,JP MORGAN ACCESS MULTI-STRATEGY FUND LLC
1285890,ING GLOBAL EQUITY DIVIDEND & PREMIUM OPPORTUNITY FUND
1287498,Eaton Vance Short Duration Diversified Income Fund
1286086,"BLUE ROCK MARKET NEUTRAL FUND, LLC"
1287480,BLACKROCK FLOATING RATE INCOME TRUST
1288992,Eaton Vance Floating-Rate Income Trust
1289213,Nuveen Floating Rate Income Opportunity Fund
1289868,Madison/Claymore Covered Call & Equity Strategy Fund
1288795,Clough Global Allocation Fund
1291334,FIRST TRUST ENHANCED EQUITY INCOME FUND
1293613,Kayne Anderson MLP Investment CO
1296250,PIMCO Income Strategy Fund II
1280948,SPECIAL VALUE OPPORTUNITIES FUND LLC
1299393,WESTERN ASSET VARIABLE RATE STRATEGIC FUND INC.
1300391,Eaton Vance Enhanced Equity Income Fund
1298699,Nuveen Equity Premium Income Fund
1301253,"Special Value Expansion Fund, LLC"
1301483,NT Alpha Strategies Fund
1302246,"HELIOS ADVANTAGE INCOME FUND, INC."
1302868,"Cohen & Steers Dividend Majors Fund, Inc."
1302624,FIRST TRUST/ABERDEEN GLOBAL OPPORTUNITY INCOME FUND
1303649,"BlackRock Diversified Income Strategies Fund, Inc."
1230869,ASA Gold & Precious Metals Ltd
1305197,FIDUCIARY/CLAYMORE MLP OPPORTUNITY FUND
1305767,Pioneer Floating Rate Trust
1306550,BlackRock Energy & Resources Trust
1307259,Capstone Church Capital Fund
1307688,"Hatteras Core Alternatives TEI Fund, L.P."
1307689,"Hatteras Master Fund, L.P."
1308335,Eaton Vance Enhanced Equity Income Fund II
1308658,Nuveen Equity Premium Opportunity Fund
1308927,Eaton Vance Tax-Managed Buy-Write Income Fund
1310445,Virtus Total Return Fund
1310709,Guggenheim Enhanced Equity Income Fund (f/k/a Old Mutual/Claymore Long-Short Fund)
1310192,"Hatteras Core Alternatives Fund, L.P."
1312483,"Mellon Optima L/S Strategy Fund, LLC"
1313510,"GAMCO Global Gold, Natural Resources & Income Trust by Gabelli"
1314104,TORTOISE NORTH AMERICAN ENERGY CORP
1314966,BlackRock Health Sciences Trust
1313259,Nuveen Tax-Advantaged Floating Rate Fund
1314128,Dow 30 Premium & Dividend Income Fund Inc.
1316463,Clough Global Equity Fund
1317080,Madison Strategic Sector Premium Fund
1319332,AGIC International & Premium Strategy Fund
1319869,TORTOISE ENERGY CAPITAL CORP
1319183,FIRST TRUST MORTGAGE INCOME FUND
1320375,BlackRock Global Opportunities Equity Trust
1320688,"Endowment TEI Fund, L.P."
1320492,Nuveen Equity Premium Advantage Fund
1318025,PIMCO Global StocksPLUS & Income Fund
1322436,Eaton Vance Tax-Managed Buy-Write Opportunities Fund
1322435,Eaton Vance Tax-Managed Global Buy-Write Opportunities Fund
1322652,"Kayne Anderson Energy Total Return Fund, Inc."
1323206,"Lazard World Dividend & Income Fund, Inc."
1326390,Macquarie Global Infrastructure Total Return Fund Inc.
1327228,Alternative Investment Partners Absolute Return Fund
1325483,Pyxis Special Situations Fund
1329992,"Arden Sage Multi-Strategy Fund, L.L.C."
1332283,BlackRock Enhanced Equity Dividend Trust
1332943,ING Global Advantage & Premium Opportunity Fund
1334510,Global Income & Currency Fund Inc.
1336050,"BlackRock Enhanced Government Fund, Inc."
1336538,MassMutual High Income Investors Fund
1336593,Evergreen International Balanced Income Fund
1336519,Campbell Multi-Strategy Trust
1338561,Nuveen Equity Premium & Growth Fund
1343668,Alternative Investment Partners Absolute Return Fund STS
1340736,Eaton Vance Tax-Managed Diversified Equity Income Fund
1343602,"HELIOS MULTI-SECTOR HIGH INCOME FUND, INC."
1343793,BlackRock Long-Term Municipal Advantage Trust
1329388,FIRST TRUST STRATEGIC HIGH INCOME FUND II
1350869,Clough Global Opportunities Fund
1356115,NexPoint Credit Strategies Fund
1359816,Nuveen Global Income Opportunities Fund
1362481,ALPINE GLOBAL DYNAMIC DIVIDEND FUND
1363421,Nuveen Global Value Opportunities Fund
1363438,FIRST TRUST/ABERDEEN EMERGING OPPORTUNITY FUND
1368493,"Morgan Stanley China A Share Fund, Inc."
1368893,BlackRock Real Asset Equity Trust
1372117,ING Risk Managed Natural Resources Fund
1373925,"Cantor Opportunistic Alternatives Fund, LLC"
1374317,"Old Field Fund, LLC"
1374318,"Old Field Master Fund, LLC"
1375340,"Cohen & Steers Closed-End Opportunity Fund, Inc."
1375387,"DWS High Income Opportunities Fund, Inc."
1375382,"Swank Energy Income Fund of North America, Inc."
1377269,"Tennenbaum Opportunities Fund V, LLC"
1378032,Rochdale Core Alternative Strategies Master Fund LLC
1377955,Rochdale Core Alternative Strategies Fund TEI LLC
1377954,Rochdale Core Alternative Strategies Fund LLC
1378701,GDL FUND
1379384,BLACKROCK CREDIT ALLOCATION INCOME TRUST IV
1379438,Eaton Vance Tax-Managed Global Diversified Equity Income Fund
1379400,ALPINE TOTAL DYNAMIC DIVIDEND FUND
1380936,GUGGENHEIM STRATEGIC OPPORTUNITIES FUND
1381186,NASDAQ Premium Income & Growth Fund Inc.
1381962,Central Park Group Multi-Event Fund
1382142,"Hatteras Core Alternatives TEI Institutional Fund, L.P."
1382143,"Hatteras Core Alternatives Institutional Fund, L.P."
1383441,AGIC Equity & Convertible Income Fund
1383812,"Tennenbaum Opportunities Partners V, LP"
1385763,Nuveen Core Equity Alpha Fund
1385632,ING Asia Pacific High Dividend Equity Income Fund
1386067,WELLS FARGO ADVANTAGE GLOBAL DIVIDEND OPPORTUNITY FUND
1388141,"Morgan Stanley Emerging Markets Domestic Debt Fund, Inc."
1388126,Pioneer Diversified High Income Trust
1390195,ALPINE GLOBAL PREMIER PROPERTIES FUND
1390109,Nuveen Diversified Currency Opportunities Fund
1391437,Gabelli Healthcare & WellnessRx Trust
1391461,Advent Claymore Convertible Securities & Income Fund II
1390840,Dow 30 Enhanced Premium & Income Fund Inc.
1392577,"RiverSource LaSalle International Real Estate Fund, Inc."
1393299,BlackRock International Growth & Income Trust
1391975,"Excelsior Multi-Strategy Hedge Fund of Funds (TE), LLC"
1391976,"Excelsior Multi-Strategy Hedge Fund of Funds (TI), LLC"
1392994,FIRST TRUST SPECIALTY FINANCE & FINANCIAL OPPORTUNITIES FUND
1389611,MLP & Strategic Equity Fund Inc.
1393662,Invesco Van Kampen Dynamic Credit Opportunities Fund
1395325,Eaton Vance Risk-Managed Diversified Equity Income Fund
1396277,Calamos Global Dynamic Income Fund
1396167,Delaware Enhanced Global Dividend & Income Fund
1395627,ING International High Dividend Equity Income Fund
1396502,John Hancock Tax-Advantaged Global Shareholder Yield Fund
1395057,"Cohen & Steers Global Income Builder, Inc"
1397173,Nuveen Tax-Advantaged Dividend Growth Fund
1398953,"Kayne Anderson Energy/Infrastructure Fund, Inc"
1399186,CORNERSTONE PROGRESSIVE RETURN FUND
1398481,AGIC Global Equity & Convertible Income Fund
1399793,"UST Global Private Markets Fund, LLC"
1400897,Cushing MLP Total Return Fund
1403275,FIRST TRUST ACTIVE DIVIDEND INCOME FUND
1123440,"CHINA FINANCE, INC."
1403238,BlackRock EcoSolutions Investment Trust
1403617,Old Mutual Tax-Advantaged Equity Income Fund
1404871,Claymore Emerging Markets Opportunities Fund
1406731,Morgan Stanley Global Long/Short Fund A
1406732,Morgan Stanley Global Long/Short Fund P
1406591,Federated Enhanced Treasury Income Fund
1406286,HIGHLAND EVENT DRIVEN FUND
1407956,Eaton Vance Risk-Managed Equity Income Opportunities Fund
1408201,TORTOISE POWER & ENERGY INFRASTRUCTURE FUND INC
1407736,"SEI Structured Credit Fund, LP"
1409953,PIMCO High Yield Municipal Opportunity Fund
1412350,PIMCO Income Opportunity Fund
1412495,Nuveen Municipal High Income Opportunity Fund 2
1412500,Claymore China Strategy Fund
1412914,BlackRock Defined Opportunity Credit Trust
1414222,Van Kampen Global Equity Dividend & Income Fund
1417060,ALPINE RISING DYNAMIC DIVIDEND FUND
1417802,"ING Infrastructure, Industrials & Materials Fund"
1418568,GLOBAL REAL ESTATE OPPORTUNITY TRUST
1358656,Millennium India Acquisition CO Inc.
1423836,Pertuity Funds
1427697,FIRST TRUST/STONECASTLE BANK SELECT INCOME FUND
1428690,AIP Multi-Strategy Fund A
1428688,AIP Multi-Strategy Fund P
1431329,National Retail Fund II
1431328,National Retail Fund III
1434130,"Morgan Stanley Frontier Emerging Markets Fund, Inc."
1435962,"TCW Commodity Strategy & Income Fund, Inc."
1437203,Highland Special Situations Fund II
1438089,"Partners Group Private Equity, LLC"
1332649,ADVANCED EQUITIES LATE STAGE OPPORTUNITIES FUND I LLC
1438893,"GAMCO Natural Resources, Gold & Income Trust by Gabelli"
1439167,"ASGI Mesirow Insight TEI Fund I, LLC"
1439169,"ASGI Mesirow Insight Fund I, LLC"
1439166,"ASGI Mesirow Insight Fund, LLC"
1441465,"Arden Sage Multi-Strategy Master Fund, L.L.C."
1441464,"Arden Sage Multi-Strategy Institutional Fund, L.L.C."
1441466,"Arden Sage Multi-Strategy TEI Institutional Fund, L.L.C."
1441883,Highland/U.S. Global Infrastructure Fund
1438246,PNMAC Mortgage Opportunity Fund LP
1438050,"PNMAC Mortgage Opportunity Fund, LLC"
1446767,Evolution U.S. Government Guaranteed Floating Rate Loan Fund a series of Evolution Investment Trust
1447246,"Partners Group Private Equity (Institutional), LLC"
1447247,"Partners Group Private Equity (Master Fund), LLC"
1448614,Goldman Sachs Municipal Opportunity Fund
1450150,"Hatteras VC Co-Investment Fund II, LLC"
1450337,BlackRock Fixed Income Value Opportunities
1450445,Nuveen AMT-Free Municipal Value Fund
1450148,"Hatteras Global Private Equity Partners Institutional, LLC"
1450091,Sovereign Emerging Biomedical Fund Inc
1452477,RMR Real Estate Income Fund
1454021,Western Asset Municipal Defined Opportunity Trust Inc.
1454567,FIRST TRUST MUNICIPAL TARGET TERM TRUST
1454741,Eaton Vance National Municipal Opportunities Trust
1454981,Nuveen New York Municipal Value Fund 2
1454979,Nuveen California Municipal Value Fund 2
1454978,Nuveen Pennsylvania Municipal Value Fund
1454980,Nuveen New Jersey Municipal Value Fund
1454839,PHL Variable Accumulation Account III
1455937,Federated Tax-Free Term Trust
1457200,Goldman Sachs Credit Strategies Fund
1458125,"DWS CREDIT OPPORTUNITY FUND, INC."
1462586,Western Asset Investment Grade Defined Opportunity Trust Inc.
1463969,Van Kampen Debt Opportunity Fund
919567,"RENN Global Entrepreneurs Fund, Inc."
1464988,"Multi-Manager Portfolio, LLC"
1464989,"Multi-Manager TEI Portfolio, LLC"
1464987,"Multi-Manager Master Portfolio, LLC"
1465814,Van Kampen Municipal Opportunity High Income Fund
1467631,ACAP Strategic Fund
1468797,FIRST TRUST GLOBAL CREDIT STRATEGIES FUND
1469121,"EXCELSIOR MULTI-STRATEGY HEDGE FUND OF FUNDS (TI 2), LLC"
1469120,"Excelsior Multi-Strategy Hedge Fund of Funds (TE 2), LLC"
1469392,Nuveen Enhanced Municipal Value Fund
1471278,"Aberdeen Global High Yield Fund, Inc."
1471420,"Columbia Seligman Premium Technology Growth Fund, Inc."
1472215,Nuveen Mortgage Opportunity Term Fund
1472516,POWERSHARES COMMODITIES OPPORTUNITY ACCE FUND
1472515,POWERSHARES BANK LOAN OPPORTUNITY ACCE FUND
1472517,POWERSHARES PREFERRED ACCE FUND
1472341,WESTERN ASSET GLOBAL CORPORATE DEFINED OPPORTUNITY FUND INC.
1474977,2009 Dole Food Automatic Common Exchange Security Trust
1475069,GUGGENHEIM Ltd DURATION TOTAL RETURN TRUST
1475764,Grubb & Ellis AGA U.S. Realty Income Fund
1475763,Grubb & Ellis AGA Worldwide Realty Fund
1476723,eUNITs (TM) 2 Year International Equity Market Participation Trust: Enhanced Upside to Cap / Buffered Downside
1476721,eUNITs (TM) 2 Year U.S. Market Participation Trust: Upside to Cap / Buffered Downside
1475457,"GROSVENOR REGISTERED MULTI-STRATEGY FUND (TI 1), LLC"
1475456,"GROSVENOR REGISTERED MULTI-STRATEGY FUND (TI 2), LLC"
1475455,"GROSVENOR REGISTERED MULTI-STRATEGY FUND (TE), LLC"
1477289,Rochdale Structured Claims Fixed Income Fund LLC
1478268,"Endowment Institutional Fund, L.P."
1478102,Western Asset Mortgage Defined Opportunity Fund Inc.
1479238,Nuveen Mortgage Opportunity Term Fund 2
1480506,"Partners Group Private Equity (TEI), LLC"
1480999,Eaton Vance Tax-Advantaged Bond & Option Strategies Fund
1480786,"JHW Pan Asia Strategies TE Fund, LLC"
1480784,"JHW Pan Asia Strategies Fund, LLC"
1480785,"JHW Pan Asia Strategies Master Fund, LLC"
1103076,EXCELSIOR VENTURE PARTNERS III LLC
1482209,Salient Alternative Strategies Master Fund
1482074,Salient Alternative Strategies Fund
1482208,Salient Alternative Strategies I Fund
1483423,Pyxis Premium Long/Short Equity Fund
1478888,Nuveen Build America Bond Fund
1486298,Blackstone / GSO Senior Floating Rate Term Fund
1487610,Neuberger Berman High Yield Strategies Fund Inc.
1489018,"SCS Hedged Opportunities Master Fund, LLC"
1489019,"SCS Hedged Opportunities Fund, LLC"
1488775,ClearBridge Energy MLP Fund Inc.
1489999,Center Coast MLP Fund
1490286,"TORTOISE MLP FUND, INC."
1491089,Gottex Multi-Alternatives Fund - I
1491091,Gottex Multi-Asset Endowment Fund - II
1491092,Gottex Multi-Asset Endowment Fund - I
1491088,Gottex Multi-Alternatives Fund - II
1491090,Gottex Multi-Asset Endowment Master Fund
1491087,Gottex Multi-Alternatives Master Fund
1492614,"ASGI Mesirow Insight Fund A, LLC"
1492615,"ASGI Mesirow Insight TEI Fund A, LLC"
1493549,"DWS FLOATING RATE OPPORTUNITIES FUND, INC."
1493523,Nuveen Build America Bond Opportunity Fund
1493683,BlackRock Build America Bond Trust
1492872,Man Long Short Fund
1495222,Oxford Lane Capital Corp.
1495027,Destra U.S. Liquidity Alpha & Income Fund
1363890,KAYNE ANDERSON ENERGY DEVELOPMENT CO
1495825,Guggenheim Build America Bonds Managed Duration Trust
1496292,ING Emerging Markets High Dividend Equity Fund
1496254,Ladenburg Thalmann Alternative Strategies Fund
1496749,John Hancock Hedged Equity & Income Fund
1494530,FIRST TRUST HIGH INCOME LONG/SHORT FUND
1492958,"Partners Group Private Equity (Institutional TEI), LLC"
1497186,Western Asset High Yield Defined Opportunity Fund Inc.
1498178,"CPG JPMorgan Alternative Strategies Fund, LLC"
1497845,"Cohen & Steers MLP Fund, Inc."
1498578,SteelPath Energy Infrastructure Investment Co
1498273,Federated Trade Finance Income Fund
1432122,FEG ABSOLUTE ACCESS FUND LLC
1498612,"Cohen & Steers Select Preferred & Income Fund, Inc."
1498258,SCA Absolute Return Fund
1277878,PERSIMMON GROWTH PARTNERS FUND LP
1499658,PERSIMMON GROWTH PARTNERS INVESTOR FUND
1499859,Global Equity Long/Short Master Fund
1499858,Morgan Creek Global Equity Long/Short Fund
1499857,Morgan Creek Global Equity Long/Short Institutional Fund
1500207,"SCS Hedged Opportunities (TE) Fund, LLC"
1500233,Ironwood Institutional Multi-Strategy Fund LLC
1500234,Ironwood Multi-Strategy Fund LLC
1493234,"Endowment Institutional TEI Fund W, L.P."
1499947,ASGI Agility Income Fund
1500096,"KAYNE ANDERSON MIDSTREAM/ENERGY FUND, INC."
1500331,Pioneer Multi Asset Floating Rate Trust
1498259,SCA Directional Fund
1494703,Buttonwood Life Settlement Fund
1501072,"RIVERNORTH TACTICAL OPPORTUNITIES FUND, INC."
1501103,Stone Harbor Emerging Markets Income Fund
1501378,"Excelsior Private Markets Fund II (TE), LLC"
1501377,"Excelsior Private Markets Fund II (TI), LLC"
1501376,"Excelsior Private Markets Fund II (Master), LLC"
1502573,Apollo Senior Floating Rate Fund Inc.
1502711,Nuveen Energy MLP Total Return Fund
1503290,Avenue Income Credit Strategies Fund
1504234,Blackstone / GSO Long-Short Credit Income Fund
1504545,Legg Mason BW Global Income Opportunities Fund Inc.
1505289,Ramius IDF Master Fund LLC
1505288,Ramius IDF LLC
1506488,Cushing Renaissance Fund
1506707,O'Connor Fund of Funds: Multi-Strategy
1506289,BlackRock Resources & Commodities Strategy Trust
1505999,"Eaton Vance Diversified Emerging Markets Local Income Fund, Inc."
1507024,Rochdale Alternative Total Return Fund LLC
1506826,ING Emerging Markets Local Bond Fund
1508372,2010 Swift Mandatory Common Exchange Security Trust
1507593,"Aberdeen Emerging Markets Debt Local Currency Fund, Inc."
1508386,FIRST TRUST SENIOR LOAN PLUS FUND
1508815,Invesco Floating Rate Corporate Credit Fund
1508781,"ASGI Aurora Opportunities Fund, LLC"
1508782,"ASGI Corbin Multi-Strategy Fund, LLC"
1509253,Nuveen Short Duration Credit Opportunities Fund
1509664,Neuberger Berman Flexible High Income Fund Inc.
1510836,Stone Harbor Hedged Duration Global Opportunity Fund
1512152,FEG ABSOLUTE ACCESS TEI FUND LLC
1513789,FIRST TRUST ENERGY INFRASTRUCTURE FUND
1514405,Eaton Vance Preferred Dividend Income Trust
1513970,Salient MLP & Energy Infrastructure Fund
1514490,"ROYCE GLOBAL VALUE TRUST, INC."
1515671,Duff & Phelps Global Utility Income Fund Inc.
1515001,Versus Capital Multi-Manager Real Estate Income Fund LLC
1515324,"Ares Dynamic Credit Allocation Fund, Inc."
1516005,Eaton Vance Structured Emerging Markets Premium Income Trust
1515610,LEGG MASON PERMAL GLOBAL ALTERNATIVES FUND INC.
1516855,Blackstone / GSO Floating Rate High Income Fund
1515940,KKR Global Credit Opportunities Fund
1517518,ClearBridge Energy MLP Opportunity Fund Inc.
1517462,BlackRock Preferred Partners LLC
1518557,MainStay DefinedTerm Municipal Opportunities Fund
1519021,Rochdale International Trade Fixed Income Fund
1519505,MILLER/HOWARD HIGH DIVIDEND FUND
1517767,Vertical Capital Income Fund
1520568,"Skybridge G II Fund, LLC"
1521404,BABSON CAPITAL GLOBAL SHORT DURATION HIGH YIELD FUND
1521971,"Center Coast Core MLP Fund I, LLC"
1521972,"Center Coast Core MLP Fund II, LLC"
1521256,Eaton Vance Inflation-Linked Income Credit Trust
1522807,Brookfield Global Listed Infrastructure Income Fund Inc.
1521945,"Triton Pacific Investment Corporation, Inc."
1523289,Multi-Strategy Growth & Income Fund
1521451,Peerless Value Opportunity Fund
1524115,J.P. Morgan Access Multi-Strategy Fund II
1525091,Invesco Total Property Market Income Fund
1524021,Paramount Access Fund
1524020,Paramount Institutional Access Fund
1525355,Western Asset Middle Market & High Yield Fund Inc.
1526104,Guggenheim Equal Weight Enhanced Equity Income Fund
1526329,"TORTOISE PIPELINE & ENERGY FUND, INC."
1525541,John Hancock Emerging Markets Income Fund
1526322,John Hancock Flexible Income Opportunities Fund
1525873,LAZARD ALTERNATIVE STRATEGIES 1099 FUND
1526697,Apollo Credit Fund Inc.
1525201,DoubleLine Opportunistic Credit Fund
1526629,Cushing Royalty & Income Fund
1525830,"Hatteras GPEP Fund II, LLC"
1527413,"FSI Low Beta Absolute Return Fund, TEI"
1527672,"Cohen & Steers Global Power & Utility Fund, Inc."
1516406,American Realty Capital Real Estate Income Fund
1527994,"Partners Group Private RE, LLC"
1527993,"Partners Group Private RE (Institutional), LLC"
1528437,BlackRock Municipal Target Term Trust
1528988,BlackRock Utility & Infrastructure Trust
1528838,DIVIDEND Fund Inc. by Gabelli
1528811,Virtus Global Multi-Sector Income Fund
1531134,NT Equity Long/Short Strategies Fund
1532713,Hatteras Sector Select Fund
1532743,Hatteras Sector Select Institutional Fund
1532716,GL Beyond Income Fund
1531015,"Global Chartist Fund, LLC"
1534052,Highland Premium Dividend Fund
1534293,Salient Midstream & MLP Fund
1534370,FIRST TRUST GLOBAL EQUITY DIVIDEND FUND
1534643,Permal Hedge Strategies Fund
1534369,FIRST TRUST STRATEGIC ALLOCATION FUND
1534368,FIRST TRUST GLOBAL RESOURCE SOLUTION FUND
1534880,"Prudential Short Duration High Yield Fund, Inc."
1534978,Reaves Global Utility & Energy Income Fund
1535091,Blackstone Alternative Alpha Fund
1535092,Blackstone Alternative Alpha Master Fund
1535273,TRIANGLE FUND LLC
1533536,"Endowment Institutional TEI Fund, L.P."
1527995,"Partners Group Private RE (Master), LLC"
1529142,BlackRock Alternatives Allocation Portfolio LLC
1529140,BlackRock Alternatives Allocation FB Portfolio LLC
1529141,BlackRock Alternatives Allocation TEI Portfolio LLC
1529139,BlackRock Alternatives Allocation FB TEI Portfolio LLC
1536886,PRIVATE ADVISORS ALTERNATIVE STRATEGIES MASTER FUND
1536887,PRIVATE ADVISORS ALTERNATIVE STRATEGIES FUND
1536470,Highland Premium Long/Short Healthcare Fund
1537610,Putnam Mortgage Recovery Fund
1539337,Nuveen Real Asset Income & Growth Fund
1541133,eUnits(TM) 2 Year U.S. Market Participation Trust 2: Upside to Cap / Buffered Downside
1541132,eUnits(TM) 2 Year U.S. Market Participation Trust 3: Upside to Cap / Buffered Downside
1541163,eUnits(TM) 2 Year U.S. Market Participation Trust 4: Upside to Cap / Buffered Downside
1541156,eUnits(TM) 2 Year U.S. Market Participation Trust 5: Upside to Cap / Buffered Downside
1541096,eUnits(TM) 2 Year U.S. Market Participation Trust 6: Upside to Cap / Buffered Downside
1543188,AllianceBernstein Multi-Manager Alternative Fund
1529138,BlackRock Alternatives Allocation Master Portfolio LLC
1510599,PIMCO Dynamic Income Fund
1543936,John Hancock Strategic Diversified Income Fund
1544228,Blackstone / GSO Short Duration High Yield Fund
1544841,ING Global Strategic Income Fund
1544317,AIP Macro Registered Fund A
1544318,AIP Macro Registered Fund P
27367,DAXOR CORP
1489471,FEG Equity Access Fund LLC
1546429,Blackstone / GSO Strategic Credit Fund
1546631,Nuveen Active Allocation Real Return Fund
1547158,"TORTOISE ENERGY INDEPENDENCE FUND, INC."
1547341,ClearBridge Energy MLP Total Return Fund Inc.
1546931,RMR Preferred Income Fund
1547775,"SCS Hedged Opportunities (1099) Fund, LLC"
1547994,Nuveen Preferred & Income Term Fund
1547624,"Arden Macro Fund, L.L.C."
1547626,"Arden Macro Master Fund, L.L.C."
1548717,"Cohen & Steers Ltd Duration Preferred & Income Fund, Inc."
1551047,Total Income (plus) Real Estate Fund
1552250,AETNA MULTI-STRATEGY 1099 FUND
1551949,Guggenheim Dynamic Opportunities Fund
1551040,Stone Harbor Emerging Markets Total Income Fund
1554496,KKR Alternative Corporate Opportunities Fund
1554497,KKR Alternative Corporate Opportunities Fund P
1554697,"Prudential Global Short Duration High Yield Fund, Inc."
1554625,"Priority Senior Secured Income Fund, Inc."
1498753,Cushing MLP Infrastructure Fund
1555457,Market Vectors Double Tax-Free Municipal Income Fund
1555085,Western Asset Middle Market Debt Fund Inc.
1556297,Pioneer Multi-Asset Credit Trust
1556336,FIRST TRUST MLP GROWTH & INCOME FUND
1555626,Duff & Phelps Diversified Income Fund Inc.
1557523,Principal Commercial Mortgage Backed Securities Income Fund
1557725,Resource Real Estate Diversified Income Fund
1556782,FIRST TRUST DIVERSIFIED SHORT DURATION FUND
1557915,Nuveen Intermediate Duration Municipal Term Fund
1558629,PIMCO Dynamic Credit Income Fund
1557265,SharesPost 100 Fund LLC
