cik,registrant_name
40417,GENERAL AMERICAN INVESTORS CO INC
18748,CENTRAL SECURITIES CORP
2230,ADAMS EXPRESS CO
99614,TRI-CONTINENTAL CORP
32598,ENGEX INC
91847,SOURCE CAPITAL INC /DE/
5094,Invesco Van Kampen Bond Fund
9521,BANCROFT FUND LTD
275694,BABSON CAPITAL CORPORATE INVESTORS
30125,Cutwater Select Income Fund
59560,LINCOLN NATIONAL INCOME FUND INC /NEW/
99197,"TRANSAMERICA INCOME SHARES, INC."
38188,FORT DEARBORN INCOME SECURITIES INC
102426,BOULDER GROWTH & INCOME FUND
67813,"MONTGOMERY STREET INCOME SECURITIES, INC"
93284,MORGAN STANLEY INCOME SECURITIES INC
75398,Western Asset Income Fund
33934,CORNERSTONE TOTAL RETURN FUND INC
65433,MEXICO FUND INC
3906,ALLIED CAPITAL CORP
216851,PETROLEUM & RESOURCES CORP
313180,KEYCO BOND FUND INC
316762,TRIDAN CORP
351786,BMC FUND INC
706685,TENN TOM VENTURE CORP
715137,HUTTON INVESTMENT PARTNERSHIP II
734373,HUTTON INVESTMENT PARTNERSHIP III
725492,PB-SB 1983 INVESTMENT PARTNERSHIP IA
746413,PB-SB 1984 INVESTMENT PARTNERSHIP I
748691,KOREA FUND INC
751018,RESTRICTED SECURITIES EXCHANGE FUND INC
753936,STAYVEST PENNY STOCK FUND INC
759828,JOHN HANCOCK INVESTORS TRUST
759866,JOHN HANCOCK INCOME SECURITIES TRUST
751414,PARTNERS GROWTH FUND
768213,PARTNERS DEFERRAL FUND
779336,ABERDEEN AUSTRALIA EQUITY FUND INC
785653,PAINEWEBBER EXECUTIVE INVESTMENTS FUND LP
786035,LIBERTY ALL STAR GROWTH FUND INC.
790202,FIRST OPPORTUNITY FUND INC
790500,ABERDEEN ASIA-PACIFIC INCOME FUND INC
791718,"EUROPEAN EQUITY FUND, INC / MD"
793040,ELLSWORTH FUND LTD
724816,VENTURE CAPITALISTS INC
794685,GABELLI EQUITY TRUST INC
795618,ASIA PACIFIC FUND INC
812090,ZWEIG FUND INC /MD/
799195,LIBERTY ALL STAR EQUITY FUND
801961,MFS MUNICIPAL INCOME TRUST
804116,ROYCE VALUE TRUST INC
805267,H&Q HEALTHCARE INVESTORS
804123,TAIWAN FUND INC
806628,DNP SELECT INCOME FUND INC
809173,MFS MULTIMARKET INCOME TRUST
809559,TCW STRATEGIC INCOME FUND INC
809708,TEMPLETON EMERGING MARKETS FUND
809844,MFS HIGH YIELD MUNICIPAL TRUST
810766,CREDIT SUISSE ASSET MANAGEMENT INCOME FUND INC
811305,FREEDOM INVESTMENT TRUST /MA/
811922,MFS GOVERNMENT MARKETS INCOME TRUST
811797,MALAYSIA FUND INC
812801,NUVEEN MUNICIPAL VALUE FUND INC
813623,"SWISS HELVETIA FUND, INC."
810943,PUTNAM HIGH INCOME SECURITIES FUND
813715,STRATEGY PORTFOLIO L P
814083,CORNERSTONE STRATEGIC VALUE FUND INC
816754,ALLIANCEBERNSTEIN INCOME FUND INC
818851,NUVEEN CALIFORNIA MUNICIPAL VALUE FUND INC
818850,NUVEEN NEW YORK MUNICIPAL VALUE FUND INC
820239,VKM CALIFORNIA MUNICIPAL TRUST
820300,COLLEGE & UNIVERSITY FACILITY LOAN TRUST ONE
822794,"THAI FUND, INC."
825202,ROYCE FOCUS TRUST INC
825345,NEW AMERICA HIGH INCOME FUND INC
826020,ING PRIME RATE TRUST
826735,MFS INTERMEDIATE INCOME TRUST
827773,PUTNAM PREMIER INCOME TRUST
828803,TEMPLETON GLOBAL INCOME FUND
830160,DWS HIGH INCOME TRUST
830271,NUVEEN MUNICIPAL INCOME FUND INC
830474,BLACKROCK HIGH INCOME SHARES
830487,WESTERN ASSET MUNICIPAL HIGH INCOME FUND INC.
830622,PUTNAM MASTER INTERMEDIATE INCOME TRUST
830977,COLLEGE & UNIVERSITY FACILITY LOAN TRUST TWO
831655,BABSON CAPITAL PARTICIPATION INVESTORS
832327,BLACKROCK INCOME TRUST INC.
833021,MFS INTERMEDIATE HIGH INCOME FUND
833040,FRANKLIN UNIVERSAL TRUST
833251,NUVEEN PREMIUM INCOME MUNICIPAL FUND INC
835333,Invesco Municipal Income Opportunities Trust
835948,"BLACKROCK MUNIVEST FUND, INC."
836412,ZWEIG TOTAL RETURN FUND INC
837951,PACHOLDER HIGH YIELD FUND INC
838131,AMERICAN INCOME FUND INC /VA
839122,DREYFUS MUNICIPAL INCOME INC
839533,DWS MUNICIPAL INCOME TRUST
842891,Invesco Municipal Premium Income Trust
842905,DWS MULTI-MARKET INCOME TRUST
845611,GABELLI CONVERTIBLE & INCOME SECURITIES FUND INC
850213,PRUDENTIAL BACHE CAPITAL PARTNERS II L P
815936,PRUDENTIAL BACHE CAPITAL PARTNERS I LP
852954,"DIAMOND HILL FINANCIAL TRENDS FUND, INC"
844172,"BLACKROCK MUNIENHANCED FUND, INC."
844790,PUTNAM MANAGED MUNICIPAL INCOME TRUST
845379,CHINA FUND INC
845606,MFS HIGH INCOME MUNICIPAL TRUST
846470,STEINHARDT FUND INC
846596,DWS STRATEGIC MUNICIPAL INCOME TRUST
846671,Invesco Van Kampen High Income Trust II
846676,"ABERDEEN CHILE FUND, INC."
847411,MFS INVESTMENT GRADE MUNICIPAL TRUST
847593,Invesco Municipal Income Opportunities Trust II
850027,"EAGLE CAPITAL GROWTH FUND, INC."
849998,NUVEEN PERFORMANCE PLUS MUNICIPAL FUND INC
851169,HELIOS TOTAL RETURN FUND INC
851170,MFS CHARTER INCOME TRUST
853180,Invesco Van Kampen Senior Loan Fund
853770,MFS INTERMARKET INCOME TRUST I
855887,DREYFUS STRATEGIC MUNICIPAL BOND FUND INC
854904,Invesco Prime Income Trust
855048,PUTNAM INVESTMENT GRADE MUNICIPAL TRUST
855886,JOHN HANCOCK PREMIUM DIVIDEND FUND
856128,MFS SPECIAL VALUE TRUST
856218,"TURKISH INVESTMENT FUND, INC."
856227,NUVEEN CALIFORNIA PERFORMANCE PLUS MUNICIPAL FUND INC
856226,NUVEEN NEW YORK PERFORMANCE PLUS MUNICIPAL FUND INC
857361,NUVEEN MUNICIPAL ADVANTAGE FUND INC
858706,NEW GERMANY FUND INC
858707,NEW IRELAND FUND INC
859796,JAPAN SMALLER CAPITALIZATION FUND INC
859120,"ABERDEEN INDONESIA FUND, INC."
859765,KAVILCO INC/WA/
860127,DRESDNER RCM INVESTMENT FUNDS INC
860188,NUVEEN MUNICIPAL MARKET OPPORTUNITY FUND INC
860489,"CENTRAL EUROPE & RUSSIA FUND, INC."
861069,Invesco Municipal Income Opportunities Trust III
861185,Invesco Value Municipal Bond Trust
861865,THAI CAPITAL FUND INC
862313,NUVEEN CALIFORNIA MUNICIPAL MARKET OPPORTUNITY FUND INC
862716,NUVEEN INVESTMENT QUALITY MUNICIPAL FUND INC
862599,"ABERDEEN LATIN AMERICA EQUITY FUND, INC."
863900,MEXICO EQUITY & INCOME FUND INC
864415,SINGAPORE FUND INC/MD/
865277,"ABERDEEN ISRAEL FUND, INC."
866095,JAPAN EQUITY FUND INC
868440,NUVEEN CALIFORNIA INVESTMENT QUALITY MUNICIPAL FUND INC
868449,NUVEEN NEW YORK INVESTMENT QUALITY MUNICIPAL FUND INC
868578,FLAHERTY & CRUMRINE PREFERRED INCOME FUND INC
869405,NUVEEN QUALITY MUNICIPAL FUND INC
872064,NUVEEN SELECT QUALITY MUNICIPAL FUND INC
870778,NUVEEN NEW JERSEY INVESTMENT QUALITY MUNICIPAL FUND INC
870780,NUVEEN PENNSYLVANIA INVESTMENT QUALITY MUNICIPAL FUND INC
873388,POLAND FUND INC /NEW/
874142,NUVEEN CALIFORNIA SELECT QUALITY MUNICIPAL FUND INC
874143,NUVEEN NEW YORK SELECT QUALITY MUNICIPAL FUND INC
874304,MONOGENESIS CORP
874506,NUVEEN QUALITY INCOME MUNICIPAL FUND INC
876717,ABERDEEN GLOBAL INCOME FUND INC
876982,Invesco Quality Municipal Investment Trust
877463,Invesco Van Kampen Municipal Trust
877649,Invesco Van Kampen Ohio Quality Municipal Trust
878242,NUVEEN MUNICIPAL OPPORTUNITY FUND INC
878198,NUVEEN MICHIGAN QUALITY INCOME MUNICIPAL FUND INC
878201,NUVEEN TEXAS QUALITY INCOME MUNICIPAL FUND
878200,NUVEEN OHIO QUALITY INCOME MUNICIPAL FUND INC
878929,MORGAN STANLEY EMERGING MARKETS FUND INC
878930,AMERICAN STRATEGIC INCOME PORTFOLIO INC
879361,"BLACKROCK MUNIYIELD FUND, INC."
879535,DTF TAX-FREE INCOME INC
879819,NUVEEN NEW YORK QUALITY INCOME MUNICIPAL FUND INC
879826,NUVEEN CALIFORNIA QUALITY INCOME MUNICIPAL FUND INC
880161,Invesco Value Municipal Trust
880280,BLACKROCK INCOME OPPORTUNITY TRUST INC.
880406,HERZFELD CARIBBEAN BASIN FUND INC
880408,CUBA FUND INC
880845,NUVEEN PREMIER MUNICIPAL INCOME FUND INC
880843,NUVEEN PREMIER MUNICIPAL OPPORTUNITY FUND INC
880851,SELIGMAN MICHIGAN QUALITY MUNICIPAL FUND INC
880850,SELIGMAN OHIO QUALITY MUNICIPAL FUND INC
880849,SELIGMAN INTERMEDIATE MUNICIPAL FUND INC
880892,Invesco Van Kampen Trust for Investment Grade Municipals
880893,Invesco Van Kampen Trust for Value Municipals
880943,STRATEGIC GLOBAL INCOME FUND INC
880966,VENEZUELA FUND INC
882071,Flaherty & Crumrine PREFERRED INCOME OPPORTUNITY FUND INC
882152,"BLACKROCK MUNIYIELD CALIFORNIA FUND, INC."
882150,"BLACKROCK MUNIYIELD NEW YORK QUALITY FUND, INC."
882151,"BLACKROCK MUNIYIELD MICHIGAN QUALITY FUND II, INC."
882153,BLACKROCK MUNIYIELD INVESTMENT FUND
882300,WESTERN ASSET INTERMEDIATE MUNI FUND INC.
883269,Invesco Van Kampen Trust for Investment Grade New Jersey Municipals
883265,Invesco Van Kampen Trust for Investment Grade New York Municipals
883412,"BLACKROCK MUNIYIELD QUALITY FUND III, INC."
883574,SENIORS POOLED RETIREMENT FUND
883618,NUVEEN SELECT TAX FREE INCOME PORTFOLIO
884121,H&Q LIFE SCIENCES INVESTORS
884152,Invesco Van Kampen Municipal Opportunity Trust
884216,"BLACKROCK MUNIYIELD NEW JERSEY FUND, INC."
884461,"LATIN AMERICAN DISCOVERY FUND, INC."
884988,SHORT TERM APPRECIATION & INCOME RETURN TRUST
885601,Invesco Value Municipal Income Trust
885125,Invesco Quality Municipal Income Trust
885712,NUVEEN NEW YORK PREMIUM INCOME MUNICIPAL FUND INC
885711,NUVEEN INSURED CALIFORNIA PREMIUM INCOME MUNICIPAL FUND INC
885734,NUVEEN PREMIUM INCOME MUNICIPAL FUND 2 INC
885733,NUVEEN SELECT TAX FREE INCOME PORTFOLIO 2
885732,NUVEEN CALIFORNIA SELECT TAX FREE INCOME PORTFOLIO
885731,NUVEEN NEW YORK SELECT TAX -FREE INCOME PORTFOLIO
886043,WESTERN ASSET MANAGED MUNICIPALS FUND INC.
886984,AMERICAN STRATEGIC INCOME PORTFOLIO INC II
887398,PUTNAM TAX FREE HEALTH CARE FUND
887394,"BLACKROCK MUNIYIELD QUALITY FUND II, INC."
890196,"BLACKROCK MUNIYIELD QUALITY FUND, INC."
887590,"DWS GLOBAL HIGH INCOME FUND, INC."
887546,GREATER CHINA FUND INC
888137,JF CHINA REGION FUND INC
888410,"BLACKROCK MUNIYIELD CALIFORNIA QUALITY FUND, INC."
888411,NUVEEN SELECT TAX FREE INCOME PORTFOLIO 3
824076,PARTNERS INCOME FUND
890119,NUVEEN SELECT MATURITIES MUNICIPAL FUND
890340,WESTERN ASSET EMERGING MARKETS INCOME FUND INC.
890393,"BLACKROCK MUNIYIELD MICHIGAN QUALITY FUND, INC."
911308,"BLACKROCK MUNIYIELD ARIZONA FUND, INC."
890515,Invesco Van Kampen Massachusetts Value Municipal Income Trust
913345,Invesco Value Municipal Securities
913342,Invesco California Municipal Securities
890897,NUVEEN MICHIGAN PREMIUM INCOME MUNICIPAL FUND INC
890898,NUVEEN NEW JERSEY PREMIUM INCOME MUNICIPAL FUND INC
891038,BLACKROCK MUNIYIELD PENNSYLVANIA QUALITY FUND
891037,"BLACKROCK MUNIYIELD NEW JERSEY QUALITY FUND, INC."
891290,COHEN & STEERS TOTAL RETURN REALTY FUND INC
891188,BLACKROCK MUNIYIELD INVESTMENT QUALITY FUND
891760,WESTERN ASSET HIGH INCOME FUND INC.
926504,GREENWICH STREET NEW YORK MUNICIPAL FUND INC
926505,GREENWICH STREET CALIFORNIA MUNICIPAL FUND INC
892992,NUVEEN ARIZONA PREMIUM INCOME MUNICIPAL FUND INC
945765,PERU FUND INC
894146,Invesco California Municipal Income Trust
894242,BLACKROCK INVESTMENT QUALITY MUNICIPAL TRUST INC.
894239,DUFF & PHELPS UTILITY & CORPORATE BOND TRUST INC
894351,WESTERN ASSET MUNICIPAL PARTNERS FUND INC.
895422,BOULDER TOTAL RETURN FUND INC
895523,WESTERN ASSET MANAGED HIGH INCOME FUND INC.
895528,Invesco Van Kampen Pennsylvania Value Municipal Income Trust
895531,Invesco Van Kampen California Value Municipal Income Trust
895574,Delaware Investments National Municipal Income Fund
895577,"DELAWARE INVESTMENTS ARIZONA MUNICIPAL INCOME FUND, INC"
895658,"DELAWARE INVESTMENTS MINNESOTA MUNICIPAL INCOME FUND II, INC"
896061,NUVEEN PREMIUM INCOME MUNICIPAL FUND 4 INC
896161,AMERICAN STRATEGIC INCOME PORTFOLIO INC III
896665,"BLACKROCK SENIOR HIGH INCOME FUND, INC."
896923,"DELAWARE INVESTMENTS DIVIDEND & INCOME FUND, INC"
897269,"BLACKROCK MUNIVEST FUND II, INC."
897427,NUVEEN PENNSYLVANIA PREMIUM INCOME MUNICIPAL FUND 2
897419,NUVEEN MASSACHUSETTS PREMIUM INCOME MUNICIPAL FUND
897424,NUVEEN MARYLAND PREMIUM INCOME MUNICIPAL FUND
897421,NUVEEN VIRGINIA PREMIUM INCOME MUNICIPAL FUND
897422,NUVEEN INSURED CALIFORNIA PREMIUM INCOME MUNICIPAL FUND 2 IN
897800,GREENWICH STREET MUNICIPAL FUND INC
897802,"SPECIAL OPPORTUNITIES FUND, INC."
897996,GLOBAL HIGH INCOME FUND INC
898496,Invesco Quality Municipal Securities
898659,Invesco New York Quality Municipal Securities
898618,Invesco California Quality Municipal Securities
899752,NUVEEN CONNECTICUT PREMIUM INCOME MUNICIPAL FUND
899761,NUVEEN NORTH CAROLINA PREMIUM INCOME MUNICIPAL FUND
899758,NUVEEN GEORGIA PREMIUM INCOME MUNICIPAL FUND
899782,NUVEEN MISSOURI PREMIUM INCOME MUNICIPAL FUND
900422,PUTNAM MUNICIPAL OPPORTUNITIES TRUST
1014743,THERMO OPPORTUNITY FUND INC
900724,"BLACKROCK CORPORATE HIGH YIELD FUND, INC."
901243,"BLACKROCK MUNIASSETS FUND, INC."
901824,MASSACHUSETTS HEALTH & EDUCATION TAX EXEMPT TRUST
902719,BLACKROCK INVESTMENT QUALITY MUNICIPAL INCOME TRUST
902731,BLACKROCK NEW JERSEY INVESTMENT QUALITY MUNICIPAL TRUST INC
902717,BLACKROCK NEW YORK INVESTMENT QUALITY MUNICIPAL TRUST INC
902750,AMERICAN MUNICIPAL INCOME PORTFOLIO INC
902748,MINNESOTA MUNICIPAL INCOME PORTFOLIO INC
902978,WESTERN ASSET EMERGING MARKETS INCOME FUND INC.
904112,MORGAN STANLEY EMERGING MARKETS DEBT FUND INC
905000,NUVEEN CALIFORNIA PREMIUM INCOME MUNICIPAL FUND
906013,ALLIANCEBERNSTEIN GLOBAL HIGH INCOME FUND INC
906237,WESTERN ASSET 2008 WORLDWIDE DOLLAR GOVERNMENT TERM TRUST INC.
906959,NUVEEN PREMIUM INCOME MUNICIPAL OPPORTUNITY FUND
907573,"Delaware Investments Colorado Municipal Income Fund, Inc."
907608,WESTERN ASSET MUNICIPAL PARTNERS FUND II INC.
908187,"PCM FUND, INC."
908785,AMERICAN SELECT PORTFOLIO INC
909112,TEMPLETON EMERGING MARKETS INCOME FUND
908993,Invesco Van Kampen Advantage Municipal Income Trust II
910068,WESTERN ASSET HIGH INCOME OPPORTUNITY FUND INC.
911638,WESTERN ASSET GLOBAL PARTNERS INCOME FUND INC.
912022,Invesco Van Kampen Select Sector Municipal Trust
912023,KOREA EQUITY FUND INC
1031235,"GLOBAL INCOME FUND, INC."
912147,"ROYCE MICRO-CAP TRUST, INC /MD/"
912734,"Invesco High Yield Investments Fund, Inc."
912729,ASIA TIGERS FUND INC
1034171,LEVCO ZERO COUPON PUT FUND I LP
913662,"ABERDEEN EMERGING MARKETS TELECOMMUNICATIONS & INFRASTRUCTURE FUND, INC."
1034665,"BLACKROCK MUNIHOLDINGS FUND, INC."
914035,WESTERN ASSET WORLDWIDE INCOME FUND INC.
1038190,"BLACKROCK MUNIHOLDINGS FUND II , INC"
916183,PIMCO STRATEGIC GLOBAL GOVERNMENT FUND INC
1038186,"BLACKROCK MUNIHOLDINGS NEW YORK QUALITY FUND, INC."
916618,"MORGAN STANLEY INDIA INVESTMENT FUND, INC."
916713,"DELAWARE INVESTMENTS GLOBAL DIVIDEND & INCOME FUND, INC"
917100,INDIA FUND INC
918708,WESTERN ASSET EMERGING MARKETS FLOATING RATE FUND INC.
918686,"MORGAN STANLEY EASTERN EUROPE FUND, INC."
1045126,BLACKROCK MUNIHOLDINGS INVESTMENT QUALITY FUND
919708,DWS STRATEGIC INCOME TRUST
919808,"MORGAN STANLEY ASIA-PACIFIC FUND, INC."
919893,TEMPLETON DRAGON FUND INC
1046384,XYZ EXCHANGEABLE SECURITIES TRUST
921671,GABELLI MULTIMEDIA TRUST INC.
922577,PRINCIPLED EQUITY MARKET FUND
1049549,"BLACKROCK CORPORATE HIGH YIELD FUND III, INC."
925683,JOHN HANCOCK BANK & THRIFT OPPORTUNITY FUND
1051004,"BLACKROCK MUNIHOLDINGS CALIFORNIA QUALITY FUND, INC."
1051003,"BLACKROCK DEBT STRATEGIES FUND, INC."
1053988,"BLACKROCK MUNIHOLDINGS NEW JERSEY QUALITY FUND, INC."
1054421,PACIFIC CORPORATE GROUP PRIVATE EQUITY FUND
1057861,DREYFUS HIGH YIELD STRATEGIES FUND
1058234,"BLACKROCK MUNIHOLDINGS QUALITY FUND, INC."
1058239,WESTERN ASSET HIGH INCOME FUND II INC.
1059386,Invesco Van Kampen Senior Income Trust
1059213,DIVIDEND & INCOME FUND
1060392,MANAGED HIGH YIELD PLUS FUND INC
930008,GLOBAL TOTAL RETURN FUND INC
1061353,CREDIT SUISSE HIGH YIELD BOND FUND
930828,TEMPLETON RUSSIA & EAST EUROPEAN FUND INC
1062978,HELIOS HIGH YIELD FUND
1064269,SEVENTH AUTOMATIC COMMON EXCHANGE SECURITY TRUST
1064014,ELK CAPITAL CORP
1000240,ACCESS CAPITAL STRATEGIES COMMUNITY INVESTMENT FUND INC
1068200,HIGHLAND FLOATING RATE FUND
1068963,LMP CORPORATE LOAN FUND INC.
1068234,BLACKROCK HIGH YIELD TRUST
1070732,EATON VANCE SENIOR INCOME TRUST
1074769,NUVEEN NEW YORK DIVIDEND ADVANTAGE MUNICIPAL FUND
1004126,DECS TRUST
1074540,EATON VANCE MUNICIPAL INCOME TRUST
1074684,EATON VANCE NATIONAL MUNICIPAL INCOME TRUST
1074685,EATON VANCE NEW YORK MUNICIPAL INCOME TRUST
1074690,EATON VANCE MASSACHUSETTS MUNICIPAL INCOME TRUST
1074686,EATON VANCE OHIO MUNICIPAL INCOME TRUST
1074687,EATON VANCE PENNSYLVANIA MUNICIPAL INCOME TRUST
1074688,EATON VANCE MICHIGAN MUNICIPAL INCOME TRUST
1074691,EATON VANCE NEW JERSEY MUNICIPAL INCOME TRUST
1074692,EATON VANCE CALIFORNIA MUNICIPAL INCOME TRUST
1074952,NUVEEN CALIFORNIA DIVIDEND ADVANTAGE MUNICIPAL FUND
1037188,BCD HITS TRUST
1012617,BSC EMPLOYEE FUND LP
1076322,ZAZOVE CONVERTIBLE SECURITIES FUND INC
1071899,"BLACKROCK MUNIHOLDINGS QUALITY FUND II, INC."
1076768,TRUST ISSUED REQUIRED EQUITY EXCHANGE SECURITIES TRUST
1076673,"Advantage Advisers Xanthus Fund, L.L.C."
1080720,GABELLI UTILITY TRUST
1068897,FOXBY CORP.
1083839,NUVEEN DIVIDEND ADVANTAGE MUNICIPAL FUND
1084206,METS TRUST
1089094,BLACKROCK STRATEGIC MUNICIPAL TRUST
1089821,BLACKROCK PENNSYLVANIA STRATEGIC MUNICIPAL TRUST
1089822,MUTUAL FUND MASTER INVESTMENT TRUST
1089876,"Advantage Advisers Whistler Fund, L.L.C."
1089917,TWELFTH AUTOMATIC COMMON EXCHANGE SECURITY TRUST
1089915,MANDATORILY EXCHANGEABLE SECURITIES TRUST
1090117,NUVEEN INSURED CALIFORNIA DIVIDEND ADVANTAGE MUNICIPAL FUND
1090120,NUVEEN MASSACHUSETTS DIVIDEND ADVANTAGE MUNICIPAL FUND
1087785,NUVEEN MICHIGAN DIVIDEND ADVANTAGE MUNICIPAL FUND
1087786,NUVEEN NEW JERSEY DIVIDEND ADVANTAGE MUNICIPAL FUND
1087787,NUVEEN PENNSYLVANIA DIVIDEND ADVANTAGE MUNICIPAL FUND
1087783,NUVEEN ARIZONA DIVIDEND ADVANTAGE MUNICIPAL FUND
1090121,NUVEEN NORTH CAROLINA DIVIDEND ADVANTAGE MUNICIPAL FUND
1087788,NUVEEN OHIO DIVIDEND ADVANTAGE MUNICIPAL FUND
1090118,NUVEEN CONNECTICUT DIVIDEND ADVANTAGE MUNICIPAL FUND
1090122,NUVEEN VIRGINIA DIVIDEND ADVANTAGE MUNICIPAL FUND
1090119,NUVEEN MARYLAND DIVIDEND ADVANTAGE MUNICIPAL FUND
1090123,NUVEEN NEW YORK DIVIDEND ADVANTAGE MUNICIPAL INCOME FUND
1090116,NUVEEN DIVIDEND ADVANTAGE MUNICIPAL INCOME FUND
1092896,MFS CALIFORNIA MUNICIPAL FUND
1093428,NUVEEN SENIOR INCOME FUND
1094647,UBS EUCALYPTUS FUND LLC
1093062,HIGHLAND FLOATING RATE ADVANTAGE FUND
1106258,"UBS WILLOW FUND, L.L.C."
1114846,HANCOCK JOHN VENTURE TECHNOLOGY FUND
1119896,EXCELSIOR MULTI-STRATEGY HEDGE FUND OF FUNDS MASTER FUND LLC
1123218,UBS JUNIPER CROSSOVER FUND LLC
1127706,NUVEEN CALIFORNIA DIVIDEND ADVANTAGE MUNICIPAL FUND 2
1124959,ING SENIOR INCOME FUND
1131063,NUVEEN NEW YORK DIVIDEND ADVANTAGE MUNICIPAL FUND 2
1131062,NUVEEN DIVIDEND ADVANTAGE MUNICIPAL FUND 2
1137391,BLACKROCK CALIFORNIA MUNICIPAL INCOME TRUST
1137392,BLACKROCK MUNICIPAL INCOME INVESTMENT TRUST
1137440,BLACKROCK NEW JERSEY MUNICIPAL INCOME TRUST
1137390,BLACKROCK NEW YORK MUNICIPAL INCOME TRUST
1137393,BLACKROCK MUNICIPAL INCOME TRUST
1137887,NUVEEN DIVIDEND ADVANTAGE MUNICIPAL FUND 3
1137888,NUVEEN CALIFORNIA DIVIDEND ADVANTAGE MUNICIPAL FUND 3
1137885,NUVEEN MARYLAND DIVIDEND ADVANTAGE MUNICIPAL FUND 2
1097668,NUVEEN GEORGIA DIVIDEND ADVANTAGE MUNICIPAL FUND
1140392,PIMCO MUNICIPAL INCOME FUND
1140411,PIMCO CALIFORNIA MUNICIPAL INCOME FUND
1140410,PIMCO NEW YORK MUNICIPAL INCOME FUND
1141766,"LAZARD ALTERNATIVE STRATEGIES FUND, L.L.C."
1145728,NUVEEN OHIO DIVIDEND ADVANTAGE MUNICIPAL FUND 2
1156202,O'Connor Fund of Funds: Event LLC
1157842,COHEN & STEERS QUALITY INCOME REALTY FUND INC
1158289,NUVEEN REAL ESTATE INCOME FUND
1159038,BLACKROCK CALIFORNIA MUNICIPAL 2018 TERM TRUST
1159040,BLACKROCK MUNICIPAL 2018 TERM TRUST
1159039,BLACKROCK NEW YORK MUNICIPAL 2018 TERM TRUST
1160469,"BLACKROCK CORPORATE HIGH YIELD FUND V, INC."
1158728,NUVEEN VIRGINIA DIVIDEND ADVANTAGE MUNICIPAL FUND 2
1158730,NUVEEN NORTH CAROLINA DIVIDEND ADVANTAGE MUNICIPAL FUND 2
1157957,O'Connor Fund of Funds: Equity Opportunity LLC
1160864,BLACKROCK CORE BOND TRUST
1158729,NUVEEN PENNSYLVANIA  DIVIDEND ADVANTAGE MUNICIPAL FUND 2
1161070,NUVEEN NEW JERSEY DIVIDEND ADVANTAGE MUNICIPAL FUND 2
1161069,NUVEEN ARIZONA DIVIDEND ADVANTAGE MUNICIPAL FUND 2
1160990,PIMCO CORPORATE & INCOME STRATEGY FUND
1162027,ALLIANCEBERNSTEIN NATIONAL MUNICIPAL INCOME FUND
1162028,ALLIANCE CALIFORNIA MUNICIPAL INCOME FUND
1162030,ALLIANCE NEW YORK MUNICIPAL INCOME FUND
1161973,MORGAN STANLEY INSTITUTIONAL FUND OF HEDGE FUNDS LP
1163792,WESTERN ASSET PREMIER BOND FUND
1164690,DECS TRUST IX
1165216,BLACKROCK STRATEGIC BOND TRUST
1165383,NUVEEN OHIO DIVIDEND ADVANTAGE MUNICIPAL FUND 3
1166203,ACP STRATEGIC OPPORTUNITIES FUND II LLC
1166572,NUVEEN CONNECTICUT DIVIDEND ADVANTAGE MUNICIPAL FUND 2
1167467,BLACKROCK MUNICIPAL BOND TRUST
1167470,BLACKROCK NEW YORK MUNICIPAL BOND TRUST
1166258,PIONEER HIGH INCOME TRUST
1169031,BLACKROCK NEW JERSEY MUNICIPAL BOND TRUST
1169029,BLACKROCK MARYLAND MUNICIPAL BOND TRUST
1169034,BLACKROCK VIRGINIA MUNICIPAL BOND TRUST
1169028,BLACKROCK MUNICIPAL BOND INVESTMENT TRUST
1169583,AETOS CAPITAL LONG/SHORT STRATEGIES FUND LLC
1169578,AETOS CAPITAL DISTRESSED INVESTMENT STRATEGIES FUND LLC
1169580,AETOS CAPITAL MULTI-STRATEGY ARBITRAGE FUND LLC
1170299,PIMCO MUNICIPAL INCOME FUND II
1170300,PIMCO CALIFORNIA MUNICIPAL INCOME FUND II
1170311,PIMCO NEW YORK MUNICIPAL INCOME FUND II
1171471,CALAMOS CONVERTIBLE OPPORTUNITIES & INCOME FUND
1172168,NUVEEN QUALITY PREFERRED INCOME FUND
1173557,LMP REAL ESTATE INCOME FUND INC.
1172054,875 TRUST CO
1173788,"HELIOS STRATEGIC MORTGAGE INCOME FUND, INC."
1174281,O'Connor Fund of Funds: Long/Short Credit Strategies LLC
1176197,BLACKROCK NEW YORK MUNICIPAL INCOME TRUST II
1176194,BLACKROCK MUNICIPAL INCOME TRUST II
1174164,Flaherty & Crumrine/CLAYMORE PREFERRED SECURITIES INCOME FUND INC
1176199,JOHN HANCOCK PREFERRED INCOME FUND
1176342,BERGER ENHANCED PORTFOLIO TRUST
1176433,NUVEEN QUALITY PREFERRED INCOME FUND 2
1176984,EATON VANCE MUNICIPAL BOND FUND
1177161,EATON VANCE CALIFORNIA MUNICIPAL BOND FUND
1177162,EATON VANCE NEW YORK MUNICIPAL BOND FUND
1177219,NUVEEN GEORGIA DIVIDEND ADVANTAGE MUNICIPAL FUND 2
1177214,NUVEEN MARYLAND DIVIDEND ADVANTAGE MUNICIPAL FUND 3
1177218,NUVEEN CONNECTICUT DIVIDEND ADVANTAGE MUNICIPAL FUND 3
1177212,NUVEEN ARIZONA DIVIDEND ADVANTAGE MUNICIPAL FUND 3
1177216,NUVEEN NORTH CAROLINA DIVIDEND ADVANTAGE MUNICIPAL FUND 3
1176366,OTC OPP FUND LLC
1176736,"ART Absolute Return Fund, Inc."
1178840,NEUBERGER BERMAN CALIFORNIA INTERMEDIATE MUNICIPAL FUND INC
1178839,NEUBERGER BERMAN INTERMEDIATE MUNICIPAL FUND INC
1178841,NEUBERGER BERMAN NEW YORK INTERMEDIATE MUNICIPAL FUND INC
1181187,BLACKROCK MUNICIPAL INCOME QUALITY TRUST
1181024,BLACKROCK NEW YORK MUNICIPAL INCOME QUALITY TRUST
1181026,BLACKROCK MUNICIPAL INCOME INVESTMENT QUALITY TRUST
1181250,BLACKROCK MUNICIPAL 2020 TERM TRUST
1181249,BLACKROCK FLORIDA MUNICIPAL 2020 TERM TRUST
1181506,PIMCO MUNICIPAL INCOME FUND III
1181504,PIMCO CALIFORNIA MUNICIPAL INCOME FUND III
1181505,PIMCO NEW YORK MUNICIPAL INCOME FUND III
1181848,SKYBRIDGE MULTI-ADVISER HEDGE FUND PORTFOLIOS LLC
1183829,FIRST AMERICAN MINNESOTA MUNICIPAL INCOME FUND II INC
1186641,O'Connor Fund of Funds: Long/Short Strategies LLC
1187520,DENALI FUND INC.
1186643,O'Connor Fund of Funds: Technology LLC
1189740,JOHN HANCOCK PREFERRED INCOME FUND II
1195739,NUVEEN NEW YORK AMT-FREE MUNICIPAL INCOME FUND
1195738,NUVEEN CALIFORNIA AMT-FREE MUNICIPAL INCOME FUND
1195737,NUVEEN AMT-FREE MUNICIPAL INCOME FUND
1196366,NUVEEN MASSACHUSETTS AMT-FREE MUNICIPAL INCOME FUND
1196869,EATON VANCE CALIFORNIA MUNICIPAL BOND FUND II
1196875,EATON VANCE NEW YORK MUNICIPAL BOND FUND II
1196867,EATON VANCE MUNICIPAL BOND FUND II
1196872,EATON VANCE MICHIGAN MUNICIPAL BOND FUND
1196871,EATON VANCE MASSACHUSETTS MUNICIPAL BOND FUND
1196876,EATON VANCE OHIO MUNICIPAL BOND FUND
1196877,EATON VANCE PENNSYLVANIA MUNICIPAL BOND FUND
1196874,EATON VANCE NEW JERSEY MUNICIPAL BOND FUND
1199004,FEDERATED PREMIER MUNICIPAL INCOME FUND
1190935,PIMCO CORPORATE & INCOME OPPORTUNITY FUND
1199923,INTERNATIONAL ASSET GROUP INC
1200446,NUVEEN QUALITY PREFERRED INCOME FUND 3
1202806,FEDERATED PREMIER INTERMEDIATE MUNICIPAL INCOME FUND
1207528,"GMAM ABSOLUTE RETURN STRATEGIES FUND, LLC"
1210123,WELLS FARGO ADVANTAGE INCOME OPPORTUNITIES FUND
1211994,FLAGSTAFF FUNDS LLC
1212030,"GROSVENOR REGISTERED MULTI-STRATEGY MASTER FUND, LLC"
1213169,BLACKROCK CREDIT ALLOCATION INCOME TRUST III
1213980,EXCELSIOR BUYOUT INVESTORS LLC
1214935,AGIC Convertible & Income Fund
1215664,"BLACKROCK CREDIT ALLOCATION INCOME TRUST II, INC."
1215913,JOHN HANCOCK PREFERRED INCOME FUND III
1216583,Nuveen Preferred Income Opportunities Fund
1217951,FRANKLIN MUTUAL RECOVERY FUND
1219120,ADVENT CLAYMORE CONVERTIBLE SECURITIES & INCOME FUND
1219360,PIMCO HIGH INCOME FUND
1222401,"BLACKROCK CORPORATE HIGH YIELD FUND VI, INC."
1222719,CALAMOS CONVERTIBLE & HIGH INCOME FUND
1223026,PIONEER MUNICIPAL HIGH INCOME TRUST
1222922,EATON VANCE LTD DURATION INCOME FUND
1205686,ACP FUNDS TRUST
1224450,COHEN & STEERS REIT & PREFERRED INCOME FUND INC
1227073,WELLS FARGO ADVANTAGE MULTI-SECTOR INCOME FUND
1227122,"HELIOS HIGH INCOME FUND, INC"
1227476,Nuveen Credit Strategies Income Fund
1228509,WESTERN ASSET GLOBAL HIGH INCOME FUND INC.
1227857,AGIC Convertible & Income Fund II
1229876,"BLACKROCK CREDIT ALLOCATION INCOME TRUST I, INC."
1227862,WESTERN ASSET EMERGING MARKETS DEBT FUND INC.
1232863,"BLACKROCK MUNI NEW YORK INTERMEDIATE DURATION FUND, INC."
1232860,"BLACKROCK MUNI INTERMEDIATE DURATION FUND, INC."
1233681,BLACKROCK LTD DURATION INCOME TRUST
1234315,ABACUS MUTUAL FUNDS INC
1233087,FRANKLIN TEMPLETON LTD DURATION INCOME TRUST
1235511,MANAGED DURATION INVESTMENT GRADE MUNICIPAL FUND
1244183,PIMCO INCOME STRATEGY FUND
1245648,FLAHERTY & CRUMRINE/CLAYMORE TOTAL RETURN FUND INC
1245986,GARTMORE VARIABLE INSURANCE TRUST III
1246323,LEHMAN BROTHERS LIQUID ASSETS TRUST
1253327,EATON VANCE TAX ADVANTAGED DIVIDEND INCOME FUND
1254370,WESTERN ASSET/CLAYMORE INFLATION-LINKED SECURITIES & INCOME FUND
1255821,NUVEEN DIVERSIFIED DIVIDEND & INCOME FUND
1258943,PIONEER MUNICIPAL HIGH INCOME ADVANTAGE TRUST
1258623,EATON VANCE SENIOR FLOATING RATE TRUST
1259708,"BLACKROCK FLOATING RATE INCOME STRATEGIES FUND, INC."
1260041,JOHN HANCOCK TAX-ADVANTAGED DIVIDEND INCOME FUND
1260563,"NFJ DIVIDEND, INTEREST & PREMIUM STRATEGY FUND"
1261166,NEUBERGER BERMAN REAL ESTATE SECURITIES INCOME FUND INC
1260729,GABELLI DIVIDEND & INCOME TRUST
1263994,REAVES UTILITY INCOME FUND
1266585,NUVEEN MUNICIPAL HIGH INCOME OPPORTUNITY FUND
1267890,GUGGENHEIM ENHANCED EQUITY STRATEGY FUND
1268533,TORTOISE ENERGY INFRASTRUCTURE CORP
1269143,"BLACKROCK FLOATING RATE INCOME STRATEGIES FUND II, INC."
1268884,CBRE CLARION GLOBAL REAL ESTATE INCOME FUND
1270131,LMP CAPITAL & INCOME FUND INC.
1270523,EATON VANCE TAX ADVANTAGED GLOBAL DIVIDEND INCOME FUND
